{
  "$id": "https://vvip.tiger/smg/merge-authorization/v1",
  "$schema": "https://json-schema.org/draft/2020-12/schema",
  "additionalProperties": false,
  "properties": {
    "approved_head": {"const": "1e7fb3c1e43415e5bfaee957b6ab553ae68bc139"},
    "authority_scope": {"const": "MERGE_ONLY"},
    "expected_main_base": {"pattern": "^[0-9a-f]{40}$", "type": "string"},
    "h1_checks": {"const": "GREEN"},
    "migration": {
      "additionalProperties": false,
      "properties": {
        "path": {"const": "supabase/migrations/20260808224500_global_launch_phase_b_marketplace_convergence.sql"},
        "sha256": {"const": "9dd28d7c02c7b1a37da59b0ac8fe28df73f656d9f9a16dcd356989cc3520a8b9"}
      },
      "required": ["path", "sha256"],
      "type": "object"
    },
    "owner_merge_authorized": {"const": false},
    "production_authority": {"const": "NONE"},
    "pull_request": {"const": 181},
    "repository": {"const": "vvipautoparts-blip/TIGER-VVIP"},
    "schema": {"const": "https://vvip.tiger/smg/merge-authorization/v1"},
    "srpc_attestation": {"const": "VERIFIED"},
    "srpc_staging": {"const": "VERIFIED"},
    "state": {"const": "AWAITING_EXACT_OWNER_AUTHORIZATION"},
    "steel_shield_pin": {"const": "VERIFIED_GREEN"}
  },
  "required": [
    "schema", "repository", "pull_request", "approved_head", "expected_main_base",
    "migration", "h1_checks", "srpc_staging", "srpc_attestation", "steel_shield_pin",
    "owner_merge_authorized", "authority_scope", "production_authority", "state"
  ],
  "type": "object"
}
